cogload,riskqns,instructions,trials.thisRepN,trials.thisTrialN,trials.thisN,trials.thisIndex,fixation.started,cognload.started,fixation.stopped,cognload.stopped,qns.started,key_resp.started,key_resp.keys,key_resp.rt,key_resp.duration,participant,session,date,expName,psychopyVersion,frameRate,
What is the result of 825 - 347?,A friend suggests investing in a startup with great potential but a high level of risk. Do you contribute financially to the startup?,None,0,0,0,2,27.81889429106377,28.261231625219807,28.314237166196108,38.256753750145435,38.256753750145435,38.256753750145435,y,22.721982332877815,None,cogload_5_charitha,001,2023-11-30_17h35.02.764,project_cogload,2023.1.3,None,
Multiply 24 by 13 and then divide the result by 4.,"You are invited to a networking event with professionals in your field, but it's on the same day as a highly anticipated concert you've been looking forward to. Do you attend the networking event?",None,0,1,1,1,61.061024541035295,61.517033166019246,61.56475220806897,71.51561058312654,71.51561058312654,71.51561058312654,y,15.132877707947046,None,cogload_5_charitha,001,2023-11-30_17h35.02.764,project_cogload,2023.1.3,None,
"Subtract 136, multiply by 5, and then add 72.","You have the chance to participate in a study abroad program during a semester, but it means delaying your graduation by one semester. Do you choose to study abroad?",None,0,2,2,3,86.69247533311136,87.15015116613358,87.18328345823102,97.14823975018226,97.14823975018226,97.14823975018226,y,11.939510874915868,None,cogload_5_charitha,001,2023-11-30_17h35.02.764,project_cogload,2023.1.3,None,
Calculate 15% of 480.,You're invited to a major social event the night before a crucial exam. Do you attend the event?,None,0,3,3,4,109.12178608309478,109.59142645820975,109.61647879122756,119.5804669582285,119.59170454111882,119.59170454111882,n,3.801173623651266,None,cogload_5_charitha,001,2023-11-30_17h35.02.764,project_cogload,2023.1.3,None,
What is the result of 945 divided by 35?,"You receive a job offer for a position related to your field of study, but it requires relocating to a different city. Do you accept the job offer?",None,0,4,4,5,123.42953900014982,123.89226095820777,123.9248532501515,133.8811212910805,133.90134104108438,133.90134104108438,y,6.404673249926418,None,cogload_5_charitha,001,2023-11-30_17h35.02.764,project_cogload,2023.1.3,None,
Count backward from 500 by subtracting 7 each time.,You have the option to take a challenging elective course that aligns with your interests but has a reputation for being demanding. Do you enroll in the course?,There will be 2 questions displayed after each cross fixation. Solve the first question in your mind. You have 10 seconds. Your response is not required. The second question will be a yes or no type question. Read it carefully and press "y" to answer yes and "n" for no.,0,5,5,0,140.33644045819528,140.80841379100457,140.83242354122922,150.8005781660322,150.8005781660322,150.8005781660322,n,6.936564040835947,None,cogload_5_charitha,001,2023-11-30_17h35.02.764,project_cogload,2023.1.3,None,
What is the result of 726 + 431?,"You are offered a leadership role in a student organization, but it comes with increased responsibilities and time commitment. Do you accept the leadership role?",None,0,6,6,6,157.7721765411552,158.23379150009714,158.26659916620702,168.2337711660657,168.2337711660657,168.2337711660657,y,5.572508540935814,None,cogload_5_charitha,001,2023-11-30_17h35.02.764,project_cogload,2023.1.3,None,
