yun,riskqns,trials.thisRepN,trials.thisTrialN,trials.thisN,trials.thisIndex,fixation.started,images.started,fixation.stopped,images.stopped,qns.started,key_resp.started,key_resp.keys,key_resp.rt,key_resp.duration,participant,session,date,expName,psychopyVersion,frameRate,
image4.jpg,"You have the chance to participate in a study abroad program during a semester, but it means delaying your graduation by one semester. Do you choose to study abroad?",0,0,0,3,80.5405197921209,80.97442275006324,81.03597600013018,82.97752391709946,82.97752391709946,82.97752391709946,y,4.142309998860583,None,noload_3_adhish,001,2023-11-30_16h01.21.282,project_noload,2023.1.3,None,
image6.jpg,"You receive a job offer for a position related to your field of study, but it requires relocating to a different city. Do you accept the job offer?",0,1,1,5,87.2006542920135,87.6549299589824,87.69677562499419,89.6468705420848,89.65619975002483,89.65619975002483,y,4.580001957016066,None,noload_3_adhish,001,2023-11-30_16h01.21.282,project_noload,2023.1.3,None,
image7.jpg,"You are offered a leadership role in a student organization, but it comes with increased responsibilities and time commitment. Do you accept the leadership role?",0,2,2,6,94.29135758406483,94.73795279208571,94.78576679201797,96.73849608399905,96.73849608399905,96.73849608399905,n,3.4965779569465667,None,noload_3_adhish,001,2023-11-30_16h01.21.282,project_noload,2023.1.3,None,
image2.jpg,"You are invited to a networking event with professionals in your field, but it's on the same day as a highly anticipated concert you've been looking forward to. Do you attend the networking event?",0,3,3,1,100.27112350007519,100.7392132091336,100.76355904201046,102.7396111250855,102.7396111250855,102.7396111250855,n,2.448426041053608,None,noload_3_adhish,001,2023-11-30_16h01.21.282,project_noload,2023.1.3,None,
image5.jpg,You're invited to a major social event the night before a crucial exam. Do you attend the event?,0,4,4,4,105.2246876670979,105.688762167003,105.71911754203029,107.68826716695912,107.68826716695912,107.68826716695912,n,2.2919246240053326,None,noload_3_adhish,001,2023-11-30_16h01.21.282,project_noload,2023.1.3,None,
image1.jpg,You have the option to take a challenging elective course that aligns with your interests but has a reputation for being demanding. Do you enroll in the course?,0,5,5,0,110.02088487497531,110.48010408412665,110.51381366699934,112.47088462510146,112.48027354199439,112.48027354199439,y,2.791544124018401,None,noload_3_adhish,001,2023-11-30_16h01.21.282,project_noload,2023.1.3,None,
image3.jpg,A friend suggests investing in a startup with great potential but a high level of risk. Do you contribute financially to the startup?,0,6,6,2,115.32583316694945,115.78014787496068,115.81955266697332,117.77247299998999,117.77247299998999,117.77247299998999,y,2.0436581659596413,None,noload_3_adhish,001,2023-11-30_16h01.21.282,project_noload,2023.1.3,None,
